{
  "task_id": "T-0002",
  "plan_version": 1,
  "hypothesis": "A focused onboarding problem statement will raise exploration-stage decision quality.",
  "work_items": [
    {
      "id": "EXP-1",
      "description": "Draft interview-driven pain-point map.",
      "adlc_stage": "explore"
    },
    {
      "id": "DES-1",
      "description": "Define two experiment options and acceptance thresholds.",
      "adlc_stage": "design"
    }
  ],
  "owner_map": {
    "EXP-1": "planner-pm",
    "DES-1": "adlc-leader"
  },
  "approval_gates": [
    {
      "stage": "explore",
      "required": true,
      "approver": "human"
    },
    {
      "stage": "design",
      "required": true,
      "approver": "human"
    },
    {
      "stage": "execute",
      "required": true,
      "approver": "human"
    },
    {
      "stage": "improve",
      "required": true,
      "approver": "human"
    }
  ],
  "success_criteria": [
    "Human reviewer approves problem framing clarity.",
    "At least one experiment is executable in < 7 days."
  ]
}
